[
  {
    "review_id": "deep-20-mathworks-optimization-onramp",
    "candidate_id": "mathworks-optimization-onramp",
    "reviewed_on": "2026-09-13",
    "canonical_url": "https://matlabacademy.mathworks.com/details/optimization-onramp/optim",
    "observed_free_access": "F0_FULL_CREDENTIAL",
    "observed_status": "active",
    "instruction_languages": ["en"],
    "subtitle_languages": [],
    "credential": "Free MathWorks completion certificate",
    "academic_credits": "No academic credit verified",
    "self_paced": true,
    "scope_notes": "Approximately two-hour browser-based introduction to optimization in MATLAB, teaching optimization variables, objectives, constraints and solving practical optimization problems with automated feedback.",
    "prerequisites": "Basic MATLAB familiarity is helpful; no advanced optimization prerequisite",
    "required_resources": "Modern browser; MATLAB Online environment is provided for the course and no paid product license is required",
    "component_evidence": {
      "pedagogy": "Concepts are introduced directly inside an interactive MATLAB environment and tied to realistic optimization problems rather than taught as passive exposition.",
      "depth": "The course is intentionally compact and introduces practical optimization workflow rather than developing optimization theory in depth.",
      "practice": "Hands-on browser exercises, automated checks and instant feedback create unusually strong practice for a two-hour course.",
      "materials": "MathWorks integrates explanation, executable examples, coding exercises and progress tracking in one environment.",
      "currency": "Optimization Onramp remains part of MathWorks' current 2026 Onramp catalogue and uses the live MATLAB Online environment.",
      "expertise": "MathWorks has direct expertise in numerical optimization, MATLAB and technical computing education.",
      "accessibility": "The course is free for everyone, browser-based, requires no separate product license and includes a shareable completion certificate."
    },
    "quality_components": {"pedagogy": 8.8, "depth": 6.8, "practice": 9.3, "materials": 8.7, "currency": 9.7, "expertise": 9.2, "accessibility": 9.4},
    "quality_score": 8.65,
    "recommendation_score": 8.4,
    "recommendation_rationale": "Excellent practical optimization onboarding with very strong interactive feedback, but the two-hour scope and MATLAB-specific workflow keep it below full university optimization courses as a general recommendation.",
    "comparators": ["mit-18-650-statistics-applications"],
    "evidence": ["https://matlabacademy.mathworks.com/details/optimization-onramp/optim", "https://www.mathworks.com/learn/tutorials/optimization-onramp.html"],
    "flags": ["optimization", "2-hours", "interactive", "matlab-specific", "free-certificate"],
    "is_current": true
  },
  {
    "review_id": "deep-20-mit-18-04-complex-variables",
    "candidate_id": "mit-18-04-complex-variables",
    "reviewed_on": "2026-09-13",
    "canonical_url": "https://ocw.mit.edu/courses/18-04-complex-variables-with-applications-spring-2018/",
    "observed_free_access": "F2_CONTENT_ONLY",
    "observed_status": "active_archive",
    "instruction_languages": ["en"],
    "subtitle_languages": [],
    "credential": "No MIT OpenCourseWare completion credential",
    "academic_credits": "No academic credit for independent OCW learners",
    "self_paced": true,
    "scope_notes": "Complete undergraduate complex-analysis course covering complex algebra and geometry, analytic functions, contour integration, Cauchy's theorem and formula, harmonic functions, conformal mappings, argument principle, Laplace transforms and related applications, with lecture/problem-solving notes, recitations, nine problem sets and exams with solutions.",
    "prerequisites": "Single-variable calculus and multivariable-calculus maturity are expected",
    "required_resources": "General-purpose computer/browser; complete course materials are downloadable and no paid software is required",
    "component_evidence": {
      "pedagogy": "The course combines conceptual lecture notes with problem-solving notes and recitations, supporting both theory and application rather than relying on lectures alone.",
      "depth": "A full semester develops core undergraduate complex analysis through contour methods, conformal mapping and applications at substantial mathematical depth.",
      "practice": "Nine problem sets with complete solutions, recitation exercises and multiple practice/exam resources provide sustained proof and computation practice.",
      "materials": "OCW exposes a complete package of lecture notes, problem-solving notes, recitations, assignments, exams and solutions suitable for independent study.",
      "currency": "Complex-analysis foundations are highly stable; the Spring 2018 date creates essentially no conceptual obsolescence for the syllabus.",
      "expertise": "MIT mathematics faculty and course staff provide strong subject expertise in analysis and applied mathematics.",
      "accessibility": "All materials are openly downloadable, but the calculus prerequisites and proof-oriented mathematical maturity create meaningful entry friction."
    },
    "quality_components": {"pedagogy": 9.3, "depth": 9.3, "practice": 9.6, "materials": 9.5, "currency": 9.4, "expertise": 9.5, "accessibility": 8.4},
    "quality_score": 9.37,
    "recommendation_score": 9.3,
    "recommendation_rationale": "An exceptionally complete free complex-analysis course with strong solution-backed practice. Its only substantial recommendation constraint is prerequisite difficulty, not age.",
    "comparators": ["mit-18-100a-real-analysis", "mit-18-03sc-differential-equations"],
    "evidence": ["https://ocw.mit.edu/courses/18-04-complex-variables-with-applications-spring-2018/", "https://ocw.mit.edu/courses/18-04-complex-variables-with-applications-spring-2018/pages/assignments/", "https://ocw.mit.edu/courses/18-04-complex-variables-with-applications-spring-2018/pages/exams/"],
    "flags": ["complex-analysis", "problem-set-heavy", "stable-foundations", "advanced-prerequisites", "no-credential"],
    "is_current": true
  },
  {
    "review_id": "deep-20-mit-18-781-theory-of-numbers",
    "candidate_id": "mit-18-781-theory-of-numbers",
    "reviewed_on": "2026-09-13",
    "canonical_url": "https://ocw.mit.edu/courses/18-781-theory-of-numbers-spring-2012/",
    "observed_free_access": "F2_CONTENT_ONLY",
    "observed_status": "active_archive",
    "instruction_languages": ["en"],
    "subtitle_languages": [],
    "credential": "No MIT OpenCourseWare completion credential",
    "academic_credits": "No academic credit for independent OCW learners",
    "self_paced": true,
    "scope_notes": "Complete undergraduate number-theory course covering divisibility, Euclidean algorithm, primes, congruences, Chinese remainder theorem, cryptographic applications, primitive roots, quadratic residues and reciprocity, with lecture notes, nine problem sets and exam/practice materials with solutions.",
    "prerequisites": "Mathematical maturity and comfort with proof are expected; no advanced number-theory prerequisite",
    "required_resources": "General-purpose computer/browser; downloadable course package and no paid software required",
    "component_evidence": {
      "pedagogy": "The course develops classical number theory through a sequence of definitions, theorems, proofs and computational applications such as RSA.",
      "depth": "A full undergraduate semester reaches from elementary divisibility through quadratic reciprocity and core algebraic-number-theory ideas.",
      "practice": "Nine problem sets with solutions plus midterm/final practice problems and solutions provide strong proof-oriented practice.",
      "materials": "Lecture notes, assignments, solutions, exam guidelines and practice examinations form a coherent independent-study package.",
      "currency": "The underlying mathematics is highly stable; the 2012 date is not a meaningful subject-currentness defect.",
      "expertise": "MIT mathematics faculty provide strong expertise in number theory and proof-based undergraduate mathematics.",
      "accessibility": "Everything is free and downloadable, but proof maturity and the abstract nature of the subject limit beginner accessibility."
    },
    "quality_components": {"pedagogy": 9.1, "depth": 9.2, "practice": 9.5, "materials": 9.1, "currency": 9.4, "expertise": 9.5, "accessibility": 8.2},
    "quality_score": 9.22,
    "recommendation_score": 9.1,
    "recommendation_rationale": "A rigorous, complete free number-theory course with excellent problem-set support. Recommendation is limited mainly by proof prerequisites and specialist scope.",
    "comparators": ["mit-6-042j-math-cs", "mit-18-100a-real-analysis"],
    "evidence": ["https://ocw.mit.edu/courses/18-781-theory-of-numbers-spring-2012/", "https://ocw.mit.edu/courses/18-781-theory-of-numbers-spring-2012/pages/assignments/", "https://ocw.mit.edu/courses/18-781-theory-of-numbers-spring-2012/pages/exams/"],
    "flags": ["number-theory", "proof-oriented", "stable-foundations", "advanced-prerequisites", "no-credential"],
    "is_current": true
  }
]
